{
  "packageId": "mcpkg-baseline-mining-001",
  "moduleId": "acquisition",
  "modelPackId": "mp-acquisition-reference",
  "modelPackVersion": "2026.06",
  "ontologyRevision": "git:b0e1ca2",
  "compiler": {
    "name": "synthetic-captured-resident-compiler",
    "version": "fixture",
    "mode": "synthetic-fixture"
  },
  "sourceEventIds": ["srcevt-baseline-mining-001"],
  "generatedAt": "2026-06-22T08:01:00Z",
  "summary": "First-session mining found acquisition boundary and qualified lead object candidates.",
  "changes": [
    {
      "changeId": "chg-baseline-mining-001",
      "kind": "new-object",
      "confidence": "medium",
      "risk": "medium",
      "affectedIds": ["unknown"],
      "evidence": [
        {
          "sourceEventId": "srcevt-baseline-mining-001",
          "locator": "document:acquisition-baseline#section-boundary",
          "excerpt": "Acquisition owns the first module boundary through qualified lead handoff."
        }
      ],
      "proposedAction": "prepare-staged-proposal",
      "candidateCard": {
        "id": "qualified-lead",
        "type": "concept",
        "status": "candidate",
        "source": "src-document-acquisition-baseline",
        "owner": "role:acquisition-owner",
        "links": {},
        "attrs": {
          "subtype": "business-object"
        },
        "summary": "Candidate primary object for the first acquisition baseline."
      }
    }
  ],
  "review": {
    "overallAction": "human-review",
    "owner": "role:acquisition-owner",
    "reason": "First baseline objects require owner confirmation before any staged proposal."
  },
  "safety": {
    "noPii": true,
    "noSecrets": true,
    "noRawPayload": true,
    "noAcceptedMutation": true
  }
}
